{
  "$schema": "https://json-schema.org/draft/2020-12/schema",
  "$id": "netra/conflict_event.schema.json",
  "title": "ConflictEvent — the ~300 byte record",
  "description": "Produced by M3 (owner B), emitted by edge/emit, ingested by M7 (owner D). Parent PRD 5.3, as amended by edge PRD A3. Serialised form MUST be <= 400 bytes.",
  "type": "object",
  "required": ["event_id", "time", "location", "type", "ttc_s", "pet_s", "severity", "vehicle_a", "vehicle_b", "conditions", "detection_quality", "track_ids", "t_video_s", "min_ttc_frame"],
  "additionalProperties": false,
  "properties": {
    "event_id": {
      "description": "evt_<8 hex>, a deterministic hash of video_id + unordered track pair + min_ttc_frame. Ingest is idempotent on this field, so it must be stable across re-runs and buffer replays.",
      "type": "string", "pattern": "^evt_[0-9a-f]{8}$"
    },
    "time": {"description": "Wall-clock ISO-8601, derived from the configured video start time plus t_video_s. Never mixed with t_video_s.", "type": "string"},
    "location": {"description": "[latitude, longitude], carried from calibration.json.", "type": "array", "minItems": 2, "maxItems": 2, "items": {"type": "number"}},
    "type": {"type": "string", "enum": ["crossing conflict", "head-on conflict", "rear-end conflict"]},
    "ttc_s": {"description": "Minimum time-to-collision observed across the encounter, on the ground plane. Never pixel space.", "type": "number", "minimum": 0},
    "pet_s": {"description": "Post-encroachment time. Null when not computed or no path crossing exists — PET is the first thing cut.", "type": ["number", "null"], "minimum": 0},
    "severity": {
      "description": "DERIVED, never hand-set. ttc_s < 0.8 -> severe, ttc_s < 1.5 -> conflict. Parent PRD 5.3 hard rule.",
      "type": "string", "enum": ["severe", "conflict"]
    },
    "vehicle_a": {"$ref": "#/$defs/vehicle"},
    "vehicle_b": {"$ref": "#/$defs/vehicle"},
    "conditions": {
      "description": "WRITTEN ONLY BY THE SERVER (M6, owner D). The edge always writes null. A populated value arriving from the edge is a bug.",
      "type": ["object", "null"]
    },
    "detection_quality": {
      "description": "Mean detector confidence across both tracks over the encounter. Carried so D can normalise conflict rates by it — detection degrades in rain and darkness, and ignoring that leads to concluding rain is safe.",
      "type": "number", "minimum": 0, "maximum": 1
    },
    "track_ids": {"description": "AMENDMENT A3.", "type": "array", "minItems": 2, "maxItems": 2, "items": {"type": "integer"}},
    "t_video_s": {"description": "AMENDMENT A3. Seconds from video start at minimum TTC. Lets C align an event to a hand-written label without guessing.", "type": "number", "minimum": 0},
    "min_ttc_frame": {"description": "AMENDMENT A3. Frame index at which ttc_s was observed.", "type": "integer", "minimum": 0}
  },
  "$defs": {
    "vehicle": {
      "type": "object",
      "required": ["type", "speed_kmh"],
      "additionalProperties": false,
      "properties": {
        "type": {"type": "string", "enum": ["car", "motorcycle", "truck", "bus", "auto", "person"]},
        "speed_kmh": {"type": "number", "minimum": 0},
        "direction": {
          "description": "OMITTED BY THE EDGE, added by D on ingest. 'against flow' requires C's learned lane directions (M5); the edge has no lane map and does not write fields it cannot compute. Emitting it as an explicit null cost 38 bytes of the 400-byte budget to say nothing, and pushed the worst-case event to 412 bytes.",
          "type": ["string", "null"], "enum": ["normal", "against flow", null]
        }
      }
    }
  },
  "$comment": "There is NO blame or fault field, and none may be added. We describe what happened; we do not assign responsibility, because we cannot verify it and being wrong harms a real person."
}
